{
  "id": "34-jetpack-compose-ktor-postgres",
  "name": "Jetpack / Compose / Ktor / Postgres",
  "category": "native",
  "maturity": "proposed",
  "description": "Proposed catalog entry 34. Specification, environment, and verification are pending; see docs/STACK_CATALOG.md.",
  "requires": [
    "to-be-determined"
  ],
  "verification": {
    "manifest": false,
    "unit": false,
    "integration": false,
    "e2e": false,
    "lastVerifiedAt": null,
    "evidencePath": null
  }
}
