{
  "id": "04-go-fiber-htmx-flutter",
  "name": "Go / Fiber / Htmx / Flutter",
  "category": "enterprise-cross-platform",
  "maturity": "proposed",
  "description": "Proposed catalog entry 04. Specification, environment, and verification are pending; see docs/STACK_CATALOG.md.",
  "requires": [
    "to-be-determined"
  ],
  "verification": {
    "manifest": false,
    "unit": false,
    "integration": false,
    "e2e": false,
    "lastVerifiedAt": null,
    "evidencePath": null
  }
}
