{
  "id": "17-laravel12-react-inertia-reactnative",
  "name": "Laravel 12 / React / Inertia / React Native",
  "category": "classic-web",
  "maturity": "scaffolded",
  "description": "Classic web stack: Laravel 12 backend with Inertia 2 + React (TypeScript) pages (four-screen journey, session-cookie auth, fixed bounded algorithm workbench, /api/v1 JSON envelope with X-Request-Id correlation, failed-login throttle with 429 + Retry-After) implemented and tested (PHPUnit feature suite + real-HTTP smoke scripts for both the API and the CSRF-protected web flow); transport-agnostic TypeScript shared layer (envelope normalizer + API client) unit-tested with vitest and consumed by a React Native Expo thin shell written against the frozen envelope contract but NOT compiled or run (no Expo/Android/iOS SDK on this machine).",
  "backend": {
    "language": "PHP",
    "framework": "Laravel",
    "version": "12.70.1"
  },
  "web": {
    "framework": "React",
    "buildTool": "Vite",
    "version": "19.3.1"
  },
  "mobile": {
    "framework": "React Native (Expo)"
  },
  "data": [
    "sqlite (tests/local)",
    "PostgreSQL 17 (production target)"
  ],
  "platforms": [
    "linux",
    "macos",
    "windows",
    "web",
    "android",
    "ios"
  ],
  "requires": [
    "PHP >= 8.2",
    "Composer",
    "Node.js"
  ],
  "versions": {
    "php": "8.3.33",
    "laravel": "12.70.1",
    "inertia-laravel": "3.5.2",
    "ziggy": "2.6.5",
    "react": "19.3.1",
    "@inertiajs/react": "2.3.29",
    "vite": "8.3.5",
    "laravel-vite-plugin": "3.2.0",
    "tailwindcss": "4.3.3",
    "typescript": "5.9.3",
    "vitest": "5.0.5",
    "node": "24"
  },
  "verification": {
    "manifest": true,
    "unit": true,
    "integration": true,
    "e2e": false,
    "lastVerifiedAt": "2026-10-25T00:00:00Z",
    "evidencePath": "verification.md"
  }
}
