{
  "id": "27-mastra-typescript-agents-nextjs",
  "name": "Mastra / Typescript / Agents / Nextjs",
  "category": "ai-native",
  "maturity": "proposed",
  "description": "Proposed catalog entry 27. Specification, environment, and verification are pending; see docs/STACK_CATALOG.md.",
  "requires": [
    "to-be-determined"
  ],
  "verification": {
    "manifest": false,
    "unit": false,
    "integration": false,
    "e2e": false,
    "lastVerifiedAt": null,
    "evidencePath": null
  }
}
