{
  "id": "29-flutter-go-grpc-protobuf",
  "name": "Flutter / Go / Grpc / Protobuf",
  "category": "mobile-first",
  "maturity": "proposed",
  "description": "Proposed catalog entry 29. Specification, environment, and verification are pending; see docs/STACK_CATALOG.md.",
  "requires": [
    "to-be-determined"
  ],
  "verification": {
    "manifest": false,
    "unit": false,
    "integration": false,
    "e2e": false,
    "lastVerifiedAt": null,
    "evidencePath": null
  }
}
