{
  "id": "09-supabase-nextjs-tailwind",
  "name": "Supabase / Nextjs / Tailwind",
  "category": "baas",
  "maturity": "proposed",
  "description": "Proposed catalog entry 09. Specification, environment, and verification are pending; see docs/STACK_CATALOG.md.",
  "requires": [
    "to-be-determined"
  ],
  "verification": {
    "manifest": false,
    "unit": false,
    "integration": false,
    "e2e": false,
    "lastVerifiedAt": null,
    "evidencePath": null
  }
}
