{
  "id": "12-firebase-angular-ionic",
  "name": "Firebase / Angular / Ionic",
  "category": "baas",
  "maturity": "proposed",
  "description": "Proposed catalog entry 12. Specification, environment, and verification are pending; see docs/STACK_CATALOG.md.",
  "requires": [
    "to-be-determined"
  ],
  "verification": {
    "manifest": false,
    "unit": false,
    "integration": false,
    "e2e": false,
    "lastVerifiedAt": null,
    "evidencePath": null
  }
}
