{
  "id": "22-rails8-hotwire-tailwind-kamal",
  "name": "Rails8 / Hotwire / Tailwind / Kamal",
  "category": "classic-web",
  "maturity": "proposed",
  "description": "Proposed catalog entry 22. Specification, environment, and verification are pending; see docs/STACK_CATALOG.md.",
  "requires": [
    "to-be-determined"
  ],
  "verification": {
    "manifest": false,
    "unit": false,
    "integration": false,
    "e2e": false,
    "lastVerifiedAt": null,
    "evidencePath": null
  }
}
