{
  "id": "32-electron-typescript-react-sqlite",
  "name": "Electron / Typescript / React / Sqlite",
  "category": "desktop",
  "maturity": "proposed",
  "description": "Proposed catalog entry 32. Specification, environment, and verification are pending; see docs/STACK_CATALOG.md.",
  "requires": [
    "to-be-determined"
  ],
  "verification": {
    "manifest": false,
    "unit": false,
    "integration": false,
    "e2e": false,
    "lastVerifiedAt": null,
    "evidencePath": null
  }
}
