{
  "id": "16-laravel12-livewire-alpine-tailwind",
  "name": "Laravel12 / Livewire / Alpine / Tailwind",
  "category": "classic-web",
  "maturity": "proposed",
  "description": "Proposed catalog entry 16. Specification, environment, and verification are pending; see docs/STACK_CATALOG.md.",
  "requires": [
    "to-be-determined"
  ],
  "verification": {
    "manifest": false,
    "unit": false,
    "integration": false,
    "e2e": false,
    "lastVerifiedAt": null,
    "evidencePath": null
  }
}
