{
  "id": "03-dotnet9-blazor-react-maui",
  "name": "Dotnet9 / Blazor / React / Maui",
  "category": "enterprise-cross-platform",
  "maturity": "proposed",
  "description": "Proposed catalog entry 03. Specification, environment, and verification are pending; see docs/STACK_CATALOG.md.",
  "requires": [
    "to-be-determined"
  ],
  "verification": {
    "manifest": false,
    "unit": false,
    "integration": false,
    "e2e": false,
    "lastVerifiedAt": null,
    "evidencePath": null
  }
}
