{
  "id": "18-mern-typescript-express-react-native",
  "name": "Mern / Typescript / Express / React / Native",
  "category": "classic-web",
  "maturity": "proposed",
  "description": "Proposed catalog entry 18. Specification, environment, and verification are pending; see docs/STACK_CATALOG.md.",
  "requires": [
    "to-be-determined"
  ],
  "verification": {
    "manifest": false,
    "unit": false,
    "integration": false,
    "e2e": false,
    "lastVerifiedAt": null,
    "evidencePath": null
  }
}
