{
  "id": "36-go-gorilla-websockets-vue3",
  "name": "Go / Gorilla / Websockets / Vue3",
  "category": "realtime",
  "maturity": "proposed",
  "description": "Proposed catalog entry 36. Specification, environment, and verification are pending; see docs/STACK_CATALOG.md.",
  "requires": [
    "to-be-determined"
  ],
  "verification": {
    "manifest": false,
    "unit": false,
    "integration": false,
    "e2e": false,
    "lastVerifiedAt": null,
    "evidencePath": null
  }
}
