{
  "id": "25-nextjs-verceled-ai-sdk-pinecone",
  "name": "Nextjs / Verceled / Ai / Sdk / Pinecone",
  "category": "ai-native",
  "maturity": "proposed",
  "description": "Proposed catalog entry 25. Specification, environment, and verification are pending; see docs/STACK_CATALOG.md.",
  "requires": [
    "to-be-determined"
  ],
  "verification": {
    "manifest": false,
    "unit": false,
    "integration": false,
    "e2e": false,
    "lastVerifiedAt": null,
    "evidencePath": null
  }
}
