{
  "id": "40-python-fastapi-websockets-threejs",
  "name": "Python / Fastapi / Websockets / Threejs",
  "category": "realtime-3d",
  "maturity": "proposed",
  "description": "Proposed catalog entry 40. Specification, environment, and verification are pending; see docs/STACK_CATALOG.md.",
  "requires": [
    "to-be-determined"
  ],
  "verification": {
    "manifest": false,
    "unit": false,
    "integration": false,
    "e2e": false,
    "lastVerifiedAt": null,
    "evidencePath": null
  }
}
