{
  "id": "21-django5-htmx-alpine-tailwind",
  "name": "Django5 / Htmx / Alpine / Tailwind",
  "category": "classic-web",
  "maturity": "proposed",
  "description": "Proposed catalog entry 21. Specification, environment, and verification are pending; see docs/STACK_CATALOG.md.",
  "requires": [
    "to-be-determined"
  ],
  "verification": {
    "manifest": false,
    "unit": false,
    "integration": false,
    "e2e": false,
    "lastVerifiedAt": null,
    "evidencePath": null
  }
}
