{
  "id": "20-fastapi-react-vite-pwa",
  "name": "Fastapi / React / Vite / Pwa",
  "category": "classic-web",
  "maturity": "proposed",
  "description": "Proposed catalog entry 20. Specification, environment, and verification are pending; see docs/STACK_CATALOG.md.",
  "requires": [
    "to-be-determined"
  ],
  "verification": {
    "manifest": false,
    "unit": false,
    "integration": false,
    "e2e": false,
    "lastVerifiedAt": null,
    "evidencePath": null
  }
}
