{
  "id": "07-rust-actix-leptos-tauri",
  "name": "Rust / Actix / Leptos / Tauri",
  "category": "enterprise-cross-platform",
  "maturity": "proposed",
  "description": "Proposed catalog entry 07. Specification, environment, and verification are pending; see docs/STACK_CATALOG.md.",
  "requires": [
    "to-be-determined"
  ],
  "verification": {
    "manifest": false,
    "unit": false,
    "integration": false,
    "e2e": false,
    "lastVerifiedAt": null,
    "evidencePath": null
  }
}
