{
  "id": "24-springboot-springai-pgvector-react",
  "name": "Springboot / Springai / Pgvector / React",
  "category": "ai-native",
  "maturity": "proposed",
  "description": "Proposed catalog entry 24. Specification, environment, and verification are pending; see docs/STACK_CATALOG.md.",
  "requires": [
    "to-be-determined"
  ],
  "verification": {
    "manifest": false,
    "unit": false,
    "integration": false,
    "e2e": false,
    "lastVerifiedAt": null,
    "evidencePath": null
  }
}
